title,date,body,url
വീട്ടിൽ ജൈവകൃഷി ചെയ്യുമ്പോൾ ചെയ്യാവുന്ന ജൈവ കീടനിയന്ത്രണ രീതികൾ,,,https://malayalam.krishijagran.com/farm-management/organic-farming/steps-to-increase-yield-in-home-gardning/
മാഗ്നോളിയ മരങ്ങൾ കൊണ്ടുള്ള മാഗ്നോളിയ ഗാർഡൻറെ വിശേഷങ്ങൾ അറിയാം,,,https://malayalam.krishijagran.com/farm-management/organic-farming/importance-of-magnolia-garden/
"സുരക്ഷിത പാലുത്പാദനം: പരിശീലന പരിപാടി, സപ്പോർട്ട് ടു ഫാം മെക്കനൈസേഷന്‍' പദ്ധതി: അപേക്ഷ ക്ഷണിച്ചു... കൂടുതൽ കാർഷിക വാർത്തകൾ",,,https://malayalam.krishijagran.com/news/safe-milk-production-training-program-support-to-farm-mechanization-project-applications-invited-more-agriculture-news/
"എരുമ വളർത്തൽ: സൗജന്യ പരിശീലന പരിപാടി, മുറ്റത്തൊരു മീന്‍തോട്ടം പദ്ധതി: അപേക്ഷ ക്ഷണിച്ചു... കൂടുതൽ കാർഷിക വാർത്തകൾ",,,https://malayalam.krishijagran.com/news/buffalo-farming-free-training-program-muttathoru-meen-thottam-project-applications-invited-more-agricultural-news/
"റബ്ബർതോട്ടങ്ങളിലെ ഇടവിളകൃഷി: ഓൺലൈൻ പരിശീലനം, മുൻഗണനാറേഷൻ കാർഡിന് അപേക്ഷിക്കാം... കൂടുതൽ കാർഷിക വാർത്തകൾ",,,https://malayalam.krishijagran.com/news/intercropping-in-rubber-plantations-online-training-you-can-apply-for-preferential-ration-card-more-agricultural-news/
'റബറിന്റെ ശാസ്ത്രീയമായ വിളവെടുപ്പ്' പ്രത്യേക പരിശീലനം സംഘടിപ്പിക്കുന്നു.... കൂടുതൽ കാർഷിക വാർത്തകൾ,,,https://malayalam.krishijagran.com/news/special-training-on-scientific-harvesting-of-rubber-is-being-organized-more-agricultural-news/
"കാട വളർത്തലിൽ പരിശീലന പരിപാടി, റബ്ബർ ആവർത്തനകൃഷി: ഹെക്ടറിന് 40,000 രൂപ സബ്സിഡി.... കൂടുതൽ കാർഷിക വാർത്തകൾ",,,https://malayalam.krishijagran.com/news/training-program-in-quail-farming-rubber-replanting-subsidy-of-rs-40-000-per-hectare-announced-by-rubber-board-more-agricultural-news/
"ക്ഷീരകർഷകർക്കായി വിവിധ വിഷയങ്ങളിൽ പരിശീലന പരിപാടി സംഘടിപ്പിക്കുന്നു, RKVY പദ്ധതി: ധനസഹായം.... കൂടുതൽ കാർഷിക വാർത്തകൾ",,,https://malayalam.krishijagran.com/news/training-program-organized-for-dairy-farmers-on-various-topics-rkvy-scheme-financial-assistance-more-agricultural-news/
News,,,https://malayalam.krishijagran.com/news
"സുരക്ഷിത പാലുത്പാദനം: പരിശീലന പരിപാടി, സപ്പോർട്ട് ടു ഫാം മെക്കനൈസേഷന്‍' പദ്ധതി: അപേക്ഷ ക്ഷണിച്ചു... കൂടുതൽ കാർഷിക വാർത്തകൾ",,,https://malayalam.krishijagran.com/news/safe-milk-production-training-program-support-to-farm-mechanization-project-applications-invited-more-agriculture-news/
